Product,Review
Bicycle,Absolutely wonderful - highly recommended!
Camera,"Pretty solid performance, would buy again."
Webcam,"Just okay, not what I expected."
Fitness Tracker,Fails to meet the expectations.
Laptop,"Terrible product, would not recommend."
Mouse,"Loved the design, but the functionality is lacking."
Humidifier,"Works like a charm, couldn't be happier!"
Keyboard,"Good for the price, but has some minor issues."
Oven,"The material feels cheap, not very durable."
Vacuum Cleaner,"Excellent quality, very satisfied with the purchase."
Hair Dryer,"Could be better, but it does the job."
Fire Stick,"Not worth the money, very disappointed."
Electric Scooter,Surprisingly good quality for the price.
Digital Photo Frame,"Stopped working after a few uses, not reliable."
Smartwatch,Fantastic! Works beyond expectations.
Mixer,Looks great but performs poorly.
Air Conditioner,"Average product, you get what you pay for."
Smartphone,"Highly efficient and reliable, love it!"
Power Bank,"Not as described, would return if possible."
Projector,"Perfect in every way, would definitely buy again."
Blender,"Mediocre, expected much more."
Electric Shaver,"Poor craftsmanship, breaks easily."
Coffee Maker,"Satisfies all my needs, great choice!"
Air Purifier,"Disappointing performance, not recommended."
Iron,"Outstanding product, top marks!"
Speaker,"Functional, but lacks in style."
Dehumidifier,"Broke on the first day, very fragile."
External Hard Drive,"Worth every penny, a must-buy."
Slow Cooker,Doesn't work as well as advertised.
Headphones,"Incredible performance, very impressive."
Television,"Not user-friendly, difficult to use."
Tablet,"Great when it works, but often malfunctions."
Electric Kettle,Reasonably priced and works well.
Drone,Misses the mark in terms of quality.
Toaster,An excellent choice for everyday use.
Sewing Machine,Too expensive for the quality offered.
Washing Machine,"Reliable and efficient, very useful."
Refrigerator,"Poor quality control, received a defective item."
Desktop Computer,"Very happy with this purchase, it's perfect."
VR Headset,"Subpar performance, would not buy this brand again."
E-book Reader,"Better than expected, pleasantly surprised."
Router,"Very disappointing, wasted my money."
Space Heater,Exceeded my expectations in every area.
Microwave,"Unreliable, it’s hit or miss."
Vacuum Cleaner,"A good investment, happy with the outcome."
Juicer,"Cheaply made, started falling apart quickly."
Alarm Clock,The best I’ve used in a long time.
Gaming Console,Definitely not worth the investment.
Fan,"Makes my life easier, happy I bought it."
Printer,"Failed after minimal use, very poor."
